Question,Answer,filter_response,filter_dict,E1,E2,E3,Prompt_0_result
How many nerd ropes would it take to go around the Earth?,8,"E1. True
E2. Count of numbers
E3. N.A.","{'E1': 'True', 'E2': 'Count of numbers', 'E3': 'N.A.'}",True,Count of numbers,N.A.,"REASON: To estimate the number of nerd ropes needed to go around the Earth, we need to consider the circumference of the Earth and the length of a single nerd rope.

ANSWER: The circumference of the Earth is approximately 40,075 kilometers (or 40,075,000 meters). A single nerd rope is approximately 25 centimeters (or 0.25 meters) long. To estimate the number of nerd ropes needed to go around the Earth, we can divide the circumference of the Earth by the length of a single nerd rope:

40,075,000 meters / 0.25 meters = 160,300,000 nerd ropes

Therefore, it would take approximately 160 million (or 1.6 x 10^8) nerd ropes to go around the Earth."
How many Americans are polled in political polls every year?,5,"E1. True
E2. Count of numbers
E3. N.A.","{'E1': 'True', 'E2': 'Count of numbers', 'E3': 'N.A.'}",True,Count of numbers,N.A.,"REASON: Political polls are conducted regularly to gauge public opinion on various issues and candidates. It is important for political analysts and strategists to have an idea of the number of people polled in order to make accurate predictions and decisions.

ESTIMATED ANSWER: Based on the population of the United States (approximately 328 million) and assuming that a small percentage of the population is polled (around 1%), we can estimate that around 3.28 million Americans are polled in political polls every year.

x = 10^6.5"
What would the file size be on an hour of 22.4.8 surround sound audio?,10,"E1. True
E2. Physical quantity with unit (data storage)
E3. bytes","{'E1': 'True', 'E2': 'Physical quantity with unit (data storage)', 'E3': 'bytes'}",True,Physical quantity with unit (data storage),bytes,"REASON: The file size of an audio recording depends on several factors, including the bit rate, sample rate, and duration of the recording. For 22.4.8 surround sound audio, we can assume a bit rate of 24 bits per sample and a sample rate of 96 kHz. 

ANSWER: x = 10^9.5

Using these assumptions, the file size for one hour of 22.4.8 surround sound audio can be estimated as follows:

24 bits/sample x 22 channels x 96,000 samples/second x 60 seconds/minute x 60 minutes = 7,864,320,000 bits

Converting to bytes, we get:

7,864,320,000 bits / 8 bits/byte = 983,040,000 bytes

Finally, converting to gigabytes, we get:

983,040,000 bytes / 1,000,000,000 bytes/gigabyte = 0.98304 gigabytes

Rounding to one significant figure, the estimated file size for one hour of 22.4.8 surround sound audio is approximately 10^9.5 bytes or 0.98 gigabytes."
How many tiles are on a room's floor?,2,"E1. True
E2. Count of numbers
E3. N.A.","{'E1': 'True', 'E2': 'Count of numbers', 'E3': 'N.A.'}",True,Count of numbers,N.A.,"REASON: To estimate the number of tiles on a room's floor, we need to consider the dimensions of the room and the size of the tiles.
 
ANSWER: Let's assume the room is 10 feet by 12 feet, which gives us an area of 120 square feet. If we assume the tiles are 1 foot by 1 foot, then we would need 120 tiles to cover the entire floor. However, we need to account for the fact that some tiles will need to be cut to fit around the edges of the room. Let's estimate that 10% of the tiles will need to be cut, which brings our total to 132 tiles. Therefore, our estimated answer is x = 10^2.12."
How loud must a sound be at its origin to be heard 100 feet (34.5 metres) away at low volume (0 dB).,2,"E1. True
E2. Physical quantity with unit (sound intensity)
E3. dB","{'E1': 'True', 'E2': 'Physical quantity with unit (sound intensity)', 'E3': 'dB'}",True,Physical quantity with unit (sound intensity),dB,"REASON: The loudness of a sound decreases with distance from its origin, and the decibel (dB) scale is logarithmic, meaning that a 10 dB increase represents a tenfold increase in loudness. Therefore, we need to estimate the loudness of the sound at its origin that would be loud enough to be heard 100 feet away at 0 dB, which is the threshold of human hearing.

ESTIMATED ANSWER: Assuming that the sound is a single tone and not affected by any obstacles or environmental factors, we can estimate that the loudness of the sound at its origin would need to be around 60 dB to be heard 100 feet away at 0 dB. This is based on the fact that the loudness of a sound decreases by 6 dB for every doubling of distance, and 60 dB represents a sound that is about as loud as a normal conversation. Therefore, we can estimate that the sound at its origin would need to be around 10^6 (1,000,000) times louder than the threshold of human hearing to be heard 100 feet away at low volume (0 dB). 

ANSWER: x = 6"
"What is the surface area, cm2, of a TiO2 pigment particle?",-8,"E1. True
E2. Physical quantity with unit (area)
E3. cm**2","{'E1': 'True', 'E2': 'Physical quantity with unit (area)', 'E3': 'cm**2'}",True,Physical quantity with unit (area),cm**2,"REASON: TiO2 pigment particles are typically in the range of 100-300 nanometers in size. Assuming a spherical shape, we can estimate the surface area using the formula for the surface area of a sphere.

ANSWER: x = 10^-13 to 10^-12 cm^2. Assuming a particle size range of 100-300 nanometers, the surface area of a TiO2 pigment particle would be approximately 3.14 x 10^-13 to 1.13 x 10^-12 cm^2."
I just cooled myself off by rubbing an ice cube on my skin until it melted. How much energy did it take from body?,4,"E1. True
E2. Physical quantity with unit (energy)
E3. Joules","{'E1': 'True', 'E2': 'Physical quantity with unit (energy)', 'E3': 'Joules'}",True,Physical quantity with unit (energy),Joules,"REASON: The amount of energy required to melt an ice cube is known as the heat of fusion, which is approximately 334 joules per gram. Assuming the ice cube was around 10 grams and was initially at a temperature of -18°C, we can estimate the amount of energy transferred from the body to the ice cube to be the product of the mass, heat of fusion, and the temperature change from -18°C to 0°C.

ANSWER: x = 10^-2. Based on the estimation above, the amount of energy transferred from the body to the ice cube is approximately 3.34 joules, which is a relatively small amount of energy."
How many stuffed animals would fit on a shelf?,1,"E1. True
E2. Count of numbers
E3. N.A.","{'E1': 'True', 'E2': 'Count of numbers', 'E3': 'N.A.'}",True,Count of numbers,N.A.,"REASON: The number of stuffed animals that can fit on a shelf depends on the size of the shelf and the size of the stuffed animals. We also need to consider how tightly we can pack the animals together and if there are any obstructions on the shelf.

ANSWER: x = 10^2. Assuming a standard shelf size of 3 feet by 1 foot, and an average stuffed animal size of 1 foot by 1 foot by 1 foot, we can estimate that about 100 stuffed animals could fit on a shelf. However, this estimate could vary depending on the specific dimensions of the shelf and the stuffed animals."
How much does it cost to leave a light on for an entire year?,0,"E1. True
E2. Physical quantity with unit (energy)
E3. Not Given","{'E1': 'True', 'E2': 'Physical quantity with unit (energy)', 'E3': 'Not Given'}",True,Physical quantity with unit (energy),Not Given,"REASON: To estimate the cost of leaving a light on for a year, we need to consider the variables involved, such as the wattage of the light bulb, the cost of electricity per kilowatt-hour, and the number of hours the light is on per day.

ESTIMATED ANSWER: Let's assume we have a 60-watt incandescent light bulb that is on for 8 hours a day. The cost of electricity varies depending on where you live, but let's estimate it at $0.12 per kilowatt-hour. 

First, we need to convert the wattage to kilowatts by dividing by 1000: 60/1000 = 0.06 kW. 

Next, we need to calculate the number of kilowatt-hours used per day: 0.06 kW x 8 hours = 0.48 kWh. 

Finally, we can calculate the cost of electricity for a year: 0.48 kWh x 365 days x $0.12/kWh = $21.02.

Therefore, the estimated cost of leaving a 60-watt light bulb on for 8 hours a day for a year is approximately $21.02. 

ANSWER: x = 1 (since the estimated cost is between $10 and $100)"
How many people do we meet in our life?,4,"E1. True
E2. Count of numbers
E3. N.A.","{'E1': 'True', 'E2': 'Count of numbers', 'E3': 'N.A.'}",True,Count of numbers,N.A.,"REASON: This is a difficult question to answer precisely, as it depends on a number of factors such as age, social circle, and lifestyle. However, we can make some educated guesses to arrive at an estimate.
 
ANSWER: x = 9
Based on an average lifespan of 80 years and assuming that we meet around 5 new people per day, we can estimate that we meet around 146,000 people in our lifetime. However, this number can vary widely depending on individual circumstances."
How many square feet of toilet paper are in the school at any point of time?,5,"QUESTION: How many square feet of toilet paper are in the school at any point of time?
UNIT: ""in""
E1. True
E2. Physical quantity with unit (area)
E3. inches","{'E1': 'True', 'E2': 'Physical quantity with unit (area)', 'E3': 'inches'}",True,Physical quantity with unit (area),inches,"REASON: To estimate the amount of toilet paper in a school, we need to consider the number of students, staff, and visitors, as well as the frequency of use and the amount of toilet paper used per visit.

ESTIMATES:
- Number of students: 500
- Number of staff: 50
- Number of visitors: 100
- Average number of visits per person per day: 2
- Average amount of toilet paper used per visit: 5 feet

CALCULATION:
Total number of people = 500 + 50 + 100 = 650
Total number of visits per day = 650 x 2 = 1300
Total amount of toilet paper used per day = 1300 x 5 = 6500 feet

Assuming the school is open for 180 days in a year, the total amount of toilet paper used in a year would be:
6500 feet x 180 days = 1,170,000 feet

ANSWER: x = 6 (10^6)"
How many minutes does the average student play video games per day?,2,"E1. True
E2. Count of numbers
E3. N.A.","{'E1': 'True', 'E2': 'Count of numbers', 'E3': 'N.A.'}",True,Count of numbers,N.A.,"REASON: The average student probably spends some time playing video games each day, but it's unlikely that they spend all of their free time doing so. Additionally, some students may not play video games at all, while others may play for hours on end. Therefore, we need to make some educated guesses about the amount of time that the average student spends playing video games each day.

ANSWER: Let's assume that the average student has about 3-4 hours of free time each day, and that they spend about 1/3 of that time playing video games. This would give us an estimate of around 1-2 hours per day. However, we should also consider that some students may play more or less than this amount, so our estimate may be off by a bit. Therefore, our estimated answer is x = 10^0 to 10^1, or 10 to 100 minutes per day."
How many more RBCs does an adult male have than an adult woman?,0,"E1. True
E2. Physical quantity with unit (volume)
E3. Liters","{'E1': 'True', 'E2': 'Physical quantity with unit (volume)', 'E3': 'Liters'}",True,Physical quantity with unit (volume),Liters,"REASON: Red blood cells (RBCs) are a key component of blood and are responsible for carrying oxygen throughout the body. The number of RBCs in the blood can vary based on factors such as age, sex, and overall health. Therefore, we can estimate the difference in the number of RBCs between adult males and females by considering these factors.

ANSWER: Based on estimates, an adult male typically has around 5-6 million RBCs per microliter of blood, while an adult female typically has around 4-5 million RBCs per microliter of blood. Therefore, an adult male may have around 1-2 million more RBCs per microliter of blood than an adult female. This difference may be more pronounced in certain populations or individuals with specific health conditions. 

x = 10^6-7"
"If all of the TiO2 pigment particles in the gallon of paint were place side by side as in a chain, how long, km, is the chain?",-13,"E1. True
E2. Physical quantity with unit (length)
E3. Not Given","{'E1': 'True', 'E2': 'Physical quantity with unit (length)', 'E3': 'Not Given'}",True,Physical quantity with unit (length),Not Given,"REASON: To estimate the length of the chain, we need to know the number of TiO2 pigment particles in a gallon of paint and the size of each particle. We can assume that the particles are roughly spherical and have an average diameter of 0.1 micrometers. We also know that a gallon of paint contains approximately 3.785 liters or 3.785 x 10^6 cubic centimeters.

ANSWER: 
1. Number of particles in a gallon of paint:
Assuming a density of TiO2 pigment particles to be 4 g/cm^3, we can calculate the number of particles in a gallon of paint as follows:
- Mass of TiO2 pigment particles in a gallon of paint = volume of paint x density of particles
- Mass of TiO2 pigment particles in a gallon of paint = 3.785 x 10^6 cm^3 x 4 g/cm^3
- Mass of TiO2 pigment particles in a gallon of paint = 1.514 x 10^7 g
- Number of TiO2 pigment particles in a gallon of paint = mass of particles / mass of one particle
- Number of TiO2 pigment particles in a gallon of paint = 1.514 x 10^7 g / (4/3 x pi x (0.1/2)^3 x 4 g/cm^3)
- Number of TiO2 pigment particles in a gallon of paint = 1.514 x 10^7 / 2.09 x 10^-16
- Number of TiO2 pigment particles in a gallon of paint = 7.23 x 10^22

2. Length of the chain:
If we assume that the TiO2 pigment particles are placed side by side in a straight line, the length of the chain would be equal to the total diameter of all the particles in the chain. Therefore, we can calculate the length of the chain as follows:
- Total diameter of all particles in the chain = number of particles x diameter of each particle
- Total diameter of all particles in the chain = 7.23 x 10^22 x 0.1 micrometers
- Total diameter of all particles in the chain = 7.23 x 10^16 micrometers
- Total diameter of all particles in the chain = 7.23 x 10^10 meters
- Total diameter"
"If a lemon can be made into a battery, could lemons jump start a car?",6,"E1. True
E2. N.A.
E3. N.A.","{'E1': 'True', 'E2': 'N.A.', 'E3': 'N.A.'}",True,N.A.,N.A.,"REASON: While lemons can be used to generate electricity, the amount of power produced is relatively small. A car requires a much larger amount of power to start, so it is unlikely that lemons could provide enough energy to jump start a car.

ANSWER: x = 3 (The amount of power required to jump start a car is typically in the range of thousands of watts, which is several orders of magnitude greater than the power produced by a lemon battery.)"
What fraction of volume does one water molecule occupy in a cup of water?,-25,"E1. True
E2. Ratio
E3. N.A.","{'E1': 'True', 'E2': 'Ratio', 'E3': 'N.A.'}",True,Ratio,N.A.,"REASON: A cup of water contains a large number of water molecules, and each molecule is very small compared to the volume of the cup. Therefore, we can assume that the fraction of volume occupied by a single water molecule is very small.

ANSWER: x = 10^-23 (Assuming the volume of a water molecule is approximately 3.3 x 10^-29 m^3 and the volume of a cup of water is approximately 250 mL or 2.5 x 10^-4 m^3, the fraction of volume occupied by a single water molecule is approximately 1.32 x 10^-25. This is a very small number, which can be expressed as 10^-23 for convenience.)"
"What is the average distance, m, between pigment particles in a paint film?",-4,"E1. True
E2. Physical quantity with unit (distance)
E3. meters","{'E1': 'True', 'E2': 'Physical quantity with unit (distance)', 'E3': 'meters'}",True,Physical quantity with unit (distance),meters,"REASON: The average distance between pigment particles in a paint film depends on various factors such as the size and shape of the particles, the thickness of the film, and the type of binder used in the paint. 

ANSWER: Let's assume that the pigment particles are spherical and have an average diameter of 100 nanometers. We can estimate the volume of each particle as (4/3)π(50 nm)^3 = 5.24 x 10^-19 m^3. Assuming a packing efficiency of 74%, we can estimate the volume fraction of pigment particles in the paint film as 0.25. 

If we assume a paint film thickness of 10 micrometers, we can estimate the number of pigment particles per unit area as (0.25 x 10^-5 m) / (5.24 x 10^-19 m^3) = 4.77 x 10^13 particles/m^2. 

To estimate the average distance between particles, we can assume a random distribution and use the formula d = √(1/N), where N is the number of particles per unit area. Plugging in the values, we get d = √(1/4.77 x 10^13) = 1.03 x 10^-7 m. 

Therefore, the estimated average distance between pigment particles in a paint film is x = 10^-7."
How many trout would it take to pull a houseboat?,3,"E1. True
E2. Count of numbers
E3. N.A.","{'E1': 'True', 'E2': 'Count of numbers', 'E3': 'N.A.'}",True,Count of numbers,N.A.,"REASON: This is a difficult question to answer precisely, as it depends on a number of variables such as the size of the houseboat, the weight of the trout, and the strength of the fishing line. However, we can make some educated guesses to arrive at a rough estimate.

ANSWER: x = 10^6 (1 million)

Assuming an average weight of 1 pound per trout, and a houseboat weighing around 10,000 pounds, we would need approximately 10,000 trout to pull the houseboat. However, this estimate may be too low, as it does not take into account the fact that trout are not particularly strong swimmers and may not be able to pull a heavy load for very long. Additionally, the fishing line would need to be very strong to support the weight of the houseboat, which would likely require a much larger number of trout. Therefore, our estimate of 1 million trout is likely more reasonable."
"What is the density, g/cc, of the Sun?",9,"E1. True
E2. Physical quantity with unit (density)
E3. g/cc","{'E1': 'True', 'E2': 'Physical quantity with unit (density)', 'E3': 'g/cc'}",True,Physical quantity with unit (density),g/cc,"REASON: The density of the Sun is a complex problem that involves many variables, including its mass, volume, and composition. However, we can make some educated guesses based on what we know about the Sun. We know that the Sun is a massive ball of gas, primarily composed of hydrogen and helium. We also know that the Sun's mass is approximately 1.989 x 10^30 kg and its volume is approximately 1.41 x 10^18 km^3.

ANSWER: Based on these estimates, we can calculate the density of the Sun using the formula density = mass/volume. Plugging in the numbers, we get:

density = 1.989 x 10^30 kg / 1.41 x 10^18 km^3

Simplifying this expression, we get:

density = 1.41 x 10^12 kg/km^3

Converting km to cm, we get:

density = 1.41 x 10^15 kg/cm^3

Therefore, the estimated density of the Sun is approximately 10^15 g/cc."
"If all humans suddenly switched to eating insects instead of all other forms of meat, how large would the farmed insect population per year be?",17.0,"E1. True
E2. Physical quantity with unit (count of insects)
E3. Not Given","{'E1': 'True', 'E2': 'Physical quantity with unit (count of insects)', 'E3': 'Not Given'}",True,Physical quantity with unit (count of insects),Not Given,"REASON: Currently, the global meat industry produces around 330 million tons of meat per year. If all humans switched to eating insects, we would need to produce a similar amount of insect protein to meet the demand. 

To estimate the farmed insect population per year, we need to consider the following variables:
1. Average weight of an insect
2. Average protein content of an insect
3. Amount of protein required per person per year
4. Number of people in the world

ASSUMPTIONS:
- We assume that the average weight of an insect is 0.1 grams.
- We assume that the average protein content of an insect is 20%.
- We assume that each person requires 50 grams of protein per day, or 18.25 kg per year.
- We assume that the current global population is 7.9 billion people.

CALCULATIONS:
To meet the protein requirements of the world's population, we would need to produce:
18.25 kg protein/person/year x 7.9 billion people = 144.275 billion kg of protein per year

Assuming that the average insect contains 20% protein, we would need to produce:
144.275 billion kg protein/year ÷ 0.2 = 721.375 billion kg of insects per year

Assuming that the average weight of an insect is 0.1 grams, we would need to produce:
721.375 billion kg/year ÷ 0.0001 kg/insect = 7.21375 trillion insects per year

ANSWER: x = 13 (10 to the power of 13)"
